{
  "schema_version": "1.0",
  "package": {
    "name": "asst-git",
    "version": "0.1.0-1",
    "arch": "x86_64"
  },
  "source": {
    "aur_commit": "f9211a3b04ea06bcd5691e11e65599105ce53467",
    "pkgbuild_sha256": "c6d9ee9786ce24904a9bcaf69365901f482c935f6a89c6b2276f43c249f260e9",
    "install_sha256": null
  },
  "analyzed_at": "2026-10-01T06:25:23.911594931+00:00",
  "scanner_version": "aur-sentry/0.1.0",
  "static_findings": [
    {
      "behavior": "NETWORK_ACCESS",
      "file": "dynamic-sandbox",
      "line": 0,
      "severity": "HIGH",
      "description": "connected to network destination(s) not declared in PKGBUILD source=() during build"
    }
  ],
  "dynamic_evidence": {
    "collected": true,
    "processes": [],
    "network": [
      {
        "destination": "172.17.0.1",
        "port": 53,
        "protocol": "undeclared",
        "timestamp": "2026-10-01T06:25:23.906923623+00:00",
        "phase": "build"
      },
      {
        "destination": "140.82.112.4",
        "port": 443,
        "protocol": "undeclared",
        "timestamp": "2026-10-01T06:25:23.906923623+00:00",
        "phase": "build"
      }
    ],
    "filesystem": []
  },
  "package_analysis": {
    "available": false,
    "file_count": 0,
    "elf_object_count": 0,
    "elf_objects": [],
    "setuid_files": 0,
    "world_writable_files": 0
  },
  "reproducibility": "UNSUPPORTED",
  "external_intelligence": [
    {
      "source": "osv.dev",
      "summary": "Code injection in npm git (GHSA-9gqr-xp86-f87h)",
      "url": "https://osv.dev/vulnerability/GHSA-9gqr-xp86-f87h"
    }
  ],
  "verdict": "SUSPICIOUS",
  "evidence_hash": "59c15bafa0996d2f26ca9a5a1b9253052866ee4829028e56156e1bb04c3981ba",
  "signature": null
}
