{
  "schema_version": "1.0",
  "package": {
    "name": "bioma-shell",
    "version": "1.0.0beta13-1",
    "arch": "x86_64"
  },
  "source": {
    "aur_commit": "80c34a40f0b36984ff2267e79068d6fa02f64815",
    "pkgbuild_sha256": "51629725b2eb300e8e7bc3091a5b8dc961f50487a89a9814f624594e8bd44ff0",
    "install_sha256": "c8f806b96614ff717493fd69c71e1a614a3374a3a24db5b6b17fd8bd0c336cd3"
  },
  "analyzed_at": "2026-09-29T22:43:59.876696980+00:00",
  "scanner_version": "aur-sentry/0.1.0",
  "static_findings": [
    {
      "behavior": "PACKAGE_INSTALLATION",
      "file": "PKGBUILD",
      "line": 55,
      "severity": "INFO",
      "description": "references external .install scriptlet"
    },
    {
      "behavior": "NETWORK_ACCESS",
      "file": "dynamic-sandbox",
      "line": 0,
      "severity": "HIGH",
      "description": "connected to network destination(s) not declared in PKGBUILD source=() during build"
    }
  ],
  "dynamic_evidence": {
    "collected": true,
    "processes": [],
    "network": [
      {
        "destination": "172.17.0.1",
        "port": 53,
        "protocol": "undeclared",
        "timestamp": "2026-09-29T22:43:59.868013655+00:00",
        "phase": "build"
      },
      {
        "destination": "20.29.134.23",
        "port": 443,
        "protocol": "undeclared",
        "timestamp": "2026-09-29T22:43:59.868013655+00:00",
        "phase": "build"
      },
      {
        "destination": "140.82.116.9",
        "port": 443,
        "protocol": "undeclared",
        "timestamp": "2026-09-29T22:43:59.868013655+00:00",
        "phase": "build"
      }
    ],
    "filesystem": []
  },
  "package_analysis": {
    "available": false,
    "file_count": 0,
    "elf_object_count": 0,
    "elf_objects": [],
    "setuid_files": 0,
    "world_writable_files": 0
  },
  "reproducibility": "UNSUPPORTED",
  "external_intelligence": [
    {
      "source": "osv.dev",
      "summary": "Cargo extracting malicious crates can fill the file system (GHSA-2hvr-h6gw-qrxp)",
      "url": "https://osv.dev/vulnerability/GHSA-2hvr-h6gw-qrxp"
    },
    {
      "source": "osv.dev",
      "summary": "Cargo prior to Rust 1.26.0 may download the wrong dependency (GHSA-9f3p-wvj7-q82x)",
      "url": "https://osv.dev/vulnerability/GHSA-9f3p-wvj7-q82x"
    },
    {
      "source": "osv.dev",
      "summary": "Cargo not respecting umask when extracting crate archives (GHSA-j3xp-wfr4-hx87)",
      "url": "https://osv.dev/vulnerability/GHSA-j3xp-wfr4-hx87"
    },
    {
      "source": "osv.dev",
      "summary": "Cargo crates in third party registries can override the cached source of other crates (GHSA-jq42-7mfv-hm57)",
      "url": "https://osv.dev/vulnerability/GHSA-jq42-7mfv-hm57"
    },
    {
      "source": "osv.dev",
      "summary": "Cargo can be coerced to share credentials between registries (GHSA-p688-r7jv-fm6f)",
      "url": "https://osv.dev/vulnerability/GHSA-p688-r7jv-fm6f"
    },
    {
      "source": "osv.dev",
      "summary": "Cargo did not verify SSH host keys (GHSA-r5w3-xm58-jv6j)",
      "url": "https://osv.dev/vulnerability/GHSA-r5w3-xm58-jv6j"
    },
    {
      "source": "osv.dev",
      "summary": "Cargo extracting malicious crates can corrupt arbitrary files (GHSA-rfj2-q3h3-hm5j)",
      "url": "https://osv.dev/vulnerability/GHSA-rfj2-q3h3-hm5j"
    },
    {
      "source": "osv.dev",
      "summary": "Malicious dependencies can inject arbitrary JavaScript into cargo-generated timing reports (GHSA-wrrj-h57r-vx9p)",
      "url": "https://osv.dev/vulnerability/GHSA-wrrj-h57r-vx9p"
    }
  ],
  "verdict": "SUSPICIOUS",
  "evidence_hash": "38f44983cf508115d237915a5e5b7c7a5edb866cd1686f82cce4e52871d0c188",
  "signature": null
}
