{
  "schema_version": "1.0",
  "package": {
    "name": "adb-wifi-scanner",
    "version": "1.1.0-1",
    "arch": "x86_64"
  },
  "source": {
    "aur_commit": "450da87a62054bafb6083692293f5eb60ed9bd38",
    "pkgbuild_sha256": "506185bfbca5dae9841ae93a176843c24a345bad596a3d395d77c6b3a8b5c622",
    "install_sha256": null
  },
  "analyzed_at": "2026-09-27T23:22:39.301545044+00:00",
  "scanner_version": "aur-sentry/0.1.0",
  "static_findings": [
    {
      "behavior": "DYNAMIC_DOWNLOAD",
      "file": "PKGBUILD",
      "line": 12,
      "severity": "LOW",
      "description": "integrity verification bypassed ('SKIP') for non-VCS source archive"
    },
    {
      "behavior": "NETWORK_ACCESS",
      "file": "dynamic-sandbox",
      "line": 0,
      "severity": "HIGH",
      "description": "connected to network destination(s) not declared in PKGBUILD source=() during install"
    }
  ],
  "dynamic_evidence": {
    "collected": true,
    "processes": [],
    "network": [
      {
        "destination": "172.17.0.1",
        "port": 53,
        "protocol": "undeclared",
        "timestamp": "2026-09-27T23:22:39.296845515+00:00",
        "phase": "install"
      },
      {
        "destination": "151.101.67.52",
        "port": 443,
        "protocol": "undeclared",
        "timestamp": "2026-09-27T23:22:39.296845515+00:00",
        "phase": "install"
      }
    ],
    "filesystem": []
  },
  "package_analysis": {
    "available": true,
    "file_count": 1,
    "elf_object_count": 0,
    "elf_objects": [],
    "setuid_files": 0,
    "world_writable_files": 0
  },
  "reproducibility": "DIVERGED",
  "external_intelligence": [],
  "verdict": "SUSPICIOUS",
  "evidence_hash": "291f7e74ab41e5edfe18cdfbd1435d925dc210d623d36331f1dcc387e899498d",
  "signature": null
}
