{
  "schema_version": "1.0",
  "package": {
    "name": "agentty-bin",
    "version": "0.9.23-1",
    "arch": "x86_64"
  },
  "source": {
    "aur_commit": "b37d9a6beff66f4a48084998ec87dd354b605a1e",
    "pkgbuild_sha256": "3ffc5f7ca9a5bffadccdca4e67fcab1c307d65dc74bf8407120e494ccbd22cb1",
    "install_sha256": null
  },
  "analyzed_at": "2026-10-16T00:43:28.427642242+00:00",
  "scanner_version": "aur-sentry/0.2.0",
  "static_findings": [
    {
      "behavior": "OBFUSCATION",
      "file": "PKGBUILD",
      "line": 1,
      "severity": "HIGH",
      "description": "Multiple short variable definitions (3 found) - possible command splicing obfuscation"
    },
    {
      "behavior": "NETWORK_ACCESS",
      "file": "dynamic-sandbox",
      "line": 0,
      "severity": "HIGH",
      "description": "connected to network destination(s) not declared in PKGBUILD source=() during build"
    }
  ],
  "dynamic_evidence": {
    "collected": true,
    "processes": [
      {
        "command": "bash -c \\n    exec 2>&1\\n    for fd in /pr\"... aur-sentry-traced env -C /home/builder/build HOME=/home/builder USER=builder LOGNAME=builder GITHUB_TOKEN=CANARY_ghp_00000000\"... AWS_SECRET_ACCESS_KEY=CANARY_FAK\"... makepkg --noconfirm --nobuild --nodeps --skippgpcheck",
        "parent": null,
        "timestamp": "2026-10-16T00:43:28.420964778+00:00",
        "phase": "build"
      },
      {
        "command": "env -C /home/builder/build HOME=/home/builder USER=builder LOGNAME=builder GITHUB_TOKEN=CANARY_ghp_00000000\"... AWS_SECRET_ACCESS_KEY=CANARY_FAK\"... makepkg --noconfirm --nobuild --nodeps --skippgpcheck",
        "parent": null,
        "timestamp": "2026-10-16T00:43:28.420964778+00:00",
        "phase": "build"
      },
      {
        "command": "makepkg --noconfirm --nobuild --nodeps --skippgpcheck",
        "parent": null,
        "timestamp": "2026-10-16T00:43:28.420964778+00:00",
        "phase": "build"
      },
      {
        "command": "date +%s",
        "parent": null,
        "timestamp": "2026-10-16T00:43:28.420964778+00:00",
        "phase": "build"
      },
      {
        "command": "gettext %s signal caught. Exiting...",
        "parent": null,
        "timestamp": "2026-10-16T00:43:28.420964778+00:00",
        "phase": "build"
      },
      {
        "command": "mkdir -p /home/builder/build",
        "parent": null,
        "timestamp": "2026-10-16T00:43:28.420964778+00:00",
        "phase": "build"
      },
      {
        "command": "sort -u",
        "parent": null,
        "timestamp": "2026-10-16T00:43:28.420964778+00:00",
        "phase": "build"
      },
      {
        "command": "wc -l",
        "parent": null,
        "timestamp": "2026-10-16T00:43:28.420964778+00:00",
        "phase": "build"
      },
      {
        "command": "grep -E ^[[:space:",
        "parent": null,
        "timestamp": "2026-10-16T00:43:28.420964778+00:00",
        "phase": "build"
      },
      {
        "command": "gettext Making package: %s",
        "parent": null,
        "timestamp": "2026-10-16T00:43:28.420964778+00:00",
        "phase": "build"
      },
      {
        "command": "date +%c",
        "parent": null,
        "timestamp": "2026-10-16T00:43:28.420964778+00:00",
        "phase": "build"
      },
      {
        "command": "gettext Skipping dependency checks.",
        "parent": null,
        "timestamp": "2026-10-16T00:43:28.420964778+00:00",
        "phase": "build"
      },
      {
        "command": "gettext WARNING:",
        "parent": null,
        "timestamp": "2026-10-16T00:43:28.420964778+00:00",
        "phase": "build"
      },
      {
        "command": "mkdir -p /home/builder/build/src",
        "parent": null,
        "timestamp": "2026-10-16T00:43:28.420964778+00:00",
        "phase": "build"
      },
      {
        "command": "chmod a-s /home/builder/build/src",
        "parent": null,
        "timestamp": "2026-10-16T00:43:28.420964778+00:00",
        "phase": "build"
      },
      {
        "command": "gettext Retrieving sources...",
        "parent": null,
        "timestamp": "2026-10-16T00:43:28.420964778+00:00",
        "phase": "build"
      },
      {
        "command": "gettext Downloading %s...",
        "parent": null,
        "timestamp": "2026-10-16T00:43:28.420964778+00:00",
        "phase": "build"
      },
      {
        "command": "/usr/bin/curl -qgb \\\"\\ -fLC - --retry 3 --retry-delay 3 -o agentty-0.9.23-x86_64.part https://github.com/1ay1/agentty/\"...",
        "parent": null,
        "timestamp": "2026-10-16T00:43:28.420964778+00:00",
        "phase": "build"
      },
      {
        "command": "mv -f /home/builder/build/agentty-0.9.\"... /home/builder/build/agentty-0.9.\"...",
        "parent": null,
        "timestamp": "2026-10-16T00:43:28.420964778+00:00",
        "phase": "build"
      },
      {
        "command": "gettext Skipping verification of source \"...",
        "parent": null,
        "timestamp": "2026-10-16T00:43:28.420964778+00:00",
        "phase": "build"
      },
      {
        "command": "gettext Validating %s files with %s...",
        "parent": null,
        "timestamp": "2026-10-16T00:43:28.420964778+00:00",
        "phase": "build"
      },
      {
        "command": "sha256sum /home/builder/build/agentty-0.9.\"...",
        "parent": null,
        "timestamp": "2026-10-16T00:43:28.420964778+00:00",
        "phase": "build"
      },
      {
        "command": "gettext Passed",
        "parent": null,
        "timestamp": "2026-10-16T00:43:28.420964778+00:00",
        "phase": "build"
      },
      {
        "command": "gettext Extracting sources...",
        "parent": null,
        "timestamp": "2026-10-16T00:43:28.420964778+00:00",
        "phase": "build"
      },
      {
        "command": "rm -f /home/builder/build/src/agentty-\"...",
        "parent": null,
        "timestamp": "2026-10-16T00:43:28.420964778+00:00",
        "phase": "build"
      },
      {
        "command": "ln -s /home/builder/build/agentty-0.9.\"... /home/builder/build/src/",
        "parent": null,
        "timestamp": "2026-10-16T00:43:28.420964778+00:00",
        "phase": "build"
      },
      {
        "command": "file -S -bizL -- agentty-0.9.23-x86_64",
        "parent": null,
        "timestamp": "2026-10-16T00:43:28.420964778+00:00",
        "phase": "build"
      },
      {
        "command": "bsdtar -tf agentty-0.9.23-x86_64 -q *",
        "parent": null,
        "timestamp": "2026-10-16T00:43:28.420964778+00:00",
        "phase": "build"
      },
      {
        "command": "gettext Sources are ready.",
        "parent": null,
        "timestamp": "2026-10-16T00:43:28.420964778+00:00",
        "phase": "build"
      },
      {
        "command": "bash -c \\n    exec 2>&1\\n    for fd in /pr\"... aur-sentry-traced env GITHUB_TOKEN=CANARY_ghp_00000000\"... AWS_SECRET_ACCESS_KEY=CANARY_FAK\"... pacman -U --noconfirm /pkg/agentty-bin-0.9.23-1-x86_64\"...",
        "parent": null,
        "timestamp": "2026-10-16T00:43:28.426984585+00:00",
        "phase": "install"
      },
      {
        "command": "env GITHUB_TOKEN=CANARY_ghp_00000000\"... AWS_SECRET_ACCESS_KEY=CANARY_FAK\"... pacman -U --noconfirm /pkg/agentty-bin-0.9.23-1-x86_64\"...",
        "parent": null,
        "timestamp": "2026-10-16T00:43:28.426984585+00:00",
        "phase": "install"
      },
      {
        "command": "pacman -U --noconfirm /pkg/agentty-bin-0.9.23-1-x86_64\"...",
        "parent": null,
        "timestamp": "2026-10-16T00:43:28.426984585+00:00",
        "phase": "install"
      },
      {
        "command": "ldconfig",
        "parent": null,
        "timestamp": "2026-10-16T00:43:28.426984585+00:00",
        "phase": "install"
      },
      {
        "command": "/usr/share/libalpm/scripts/syste\"... update",
        "parent": null,
        "timestamp": "2026-10-16T00:43:28.426984585+00:00",
        "phase": "install"
      },
      {
        "command": "touch -c /usr",
        "parent": null,
        "timestamp": "2026-10-16T00:43:28.426984585+00:00",
        "phase": "install"
      },
      {
        "command": "bash -c \\n    exec 2>&1\\n    for fd in /pr\"... aur-sentry-traced pacman -R --noconfirm agentty-bin",
        "parent": null,
        "timestamp": "2026-10-16T00:43:28.426984585+00:00",
        "phase": "install"
      },
      {
        "command": "pacman -R --noconfirm agentty-bin",
        "parent": null,
        "timestamp": "2026-10-16T00:43:28.426984585+00:00",
        "phase": "install"
      }
    ],
    "network": [
      {
        "destination": "10.0.2.3",
        "port": 53,
        "protocol": "undeclared",
        "timestamp": "2026-10-16T00:43:28.420964778+00:00",
        "phase": "build"
      },
      {
        "destination": "172.182.252.133",
        "port": 443,
        "protocol": "undeclared",
        "timestamp": "2026-10-16T00:43:28.420964778+00:00",
        "phase": "build"
      },
      {
        "destination": "185.199.110.133",
        "port": 443,
        "protocol": "undeclared",
        "timestamp": "2026-10-16T00:43:28.420964778+00:00",
        "phase": "build"
      }
    ],
    "filesystem": []
  },
  "package_analysis": {
    "available": true,
    "file_count": 1,
    "elf_object_count": 1,
    "elf_objects": [
      {
        "path": "usr/bin/agentty",
        "arch": "Advanced Micro Devices X86-64",
        "stripped": true,
        "pie": false
      }
    ],
    "setuid_files": 0,
    "world_writable_files": 0
  },
  "reproducibility": "DIVERGED",
  "external_intelligence": [],
  "verdict": "SUSPICIOUS",
  "evidence_hash": "2bdeb06975625a1b0e7e7c07c78dc5176b1af58dc7a2b7dcb10cc71e5ac15de9",
  "signature": null
}
