{
  "schema_version": "1.0",
  "package": {
    "name": "bettbox",
    "version": "1.19.4-1",
    "arch": "x86_64"
  },
  "source": {
    "aur_commit": "fec41f927eb49512d277c17aa95e96494a9eb39e",
    "pkgbuild_sha256": "834aafc1f76e576f51c8916b22ed0012c637c18ab659154eb55a4db66732a9e4",
    "install_sha256": null
  },
  "analyzed_at": "2026-10-01T20:00:22.982748243+00:00",
  "scanner_version": "aur-sentry/0.1.0",
  "static_findings": [
    {
      "behavior": "NETWORK_ACCESS",
      "file": "dynamic-sandbox",
      "line": 0,
      "severity": "HIGH",
      "description": "connected to network destination(s) not declared in PKGBUILD source=() during build"
    }
  ],
  "dynamic_evidence": {
    "collected": true,
    "processes": [],
    "network": [
      {
        "destination": "172.17.0.1",
        "port": 53,
        "protocol": "undeclared",
        "timestamp": "2026-10-01T20:00:22.962285300+00:00",
        "phase": "build"
      },
      {
        "destination": "140.82.114.4",
        "port": 443,
        "protocol": "declared-source",
        "timestamp": "2026-10-01T20:00:22.962285300+00:00",
        "phase": "build"
      },
      {
        "destination": "140.82.112.9",
        "port": 443,
        "protocol": "undeclared",
        "timestamp": "2026-10-01T20:00:22.962285300+00:00",
        "phase": "build"
      }
    ],
    "filesystem": []
  },
  "package_analysis": {
    "available": false,
    "file_count": 0,
    "elf_object_count": 0,
    "elf_objects": [],
    "setuid_files": 0,
    "world_writable_files": 0
  },
  "reproducibility": "UNSUPPORTED",
  "external_intelligence": [
    {
      "source": "osv.dev",
      "summary": "Downloads Resources over HTTP in cmake (GHSA-4j59-hfw6-6w7h)",
      "url": "https://osv.dev/vulnerability/GHSA-4j59-hfw6-6w7h"
    },
    {
      "source": "osv.dev",
      "summary": "Patchelf out-of-bounds read (GHSA-5pcj-3m26-w633)",
      "url": "https://osv.dev/vulnerability/GHSA-5pcj-3m26-w633"
    },
    {
      "source": "osv.dev",
      "summary": "Code injection in npm git (GHSA-9gqr-xp86-f87h)",
      "url": "https://osv.dev/vulnerability/GHSA-9gqr-xp86-f87h"
    },
    {
      "source": "osv.dev",
      "summary": "Patchelf v0.9 was discovered to contain an out-of-bounds read via the function modifyRPath at src/patchelf.cc. (PYSEC-2022-43144)",
      "url": "https://osv.dev/vulnerability/PYSEC-2022-43144"
    }
  ],
  "verdict": "SUSPICIOUS",
  "evidence_hash": "add143bccca276017eb2a647222210c4c4e40afc7036ebc7cbaa2c9dae8ba59a",
  "signature": null
}
