{
  "schema_version": "1.0",
  "package": {
    "name": "alphadb-bin",
    "version": "1.0.0_beta.51-1",
    "arch": "x86_64"
  },
  "source": {
    "aur_commit": "7876fda751a3349551d61d16778f5ed2188efdcb",
    "pkgbuild_sha256": "7b5097efc3a99ad1474014815be532bdde2351274b7f8b79ba4678a1608104eb",
    "install_sha256": null
  },
  "analyzed_at": "2026-10-08T20:14:15.035497283+00:00",
  "scanner_version": "aur-sentry/0.2.0",
  "static_findings": [
    {
      "behavior": "NETWORK_ACCESS",
      "file": "dynamic-sandbox",
      "line": 0,
      "severity": "HIGH",
      "description": "connected to network destination(s) not declared in PKGBUILD source=() during build"
    }
  ],
  "dynamic_evidence": {
    "collected": true,
    "processes": [
      {
        "command": "bash -c \\n    exec 2>&1\\n    for fd in /pr\"... aur-sentry-traced env -C /home/builder/build HOME=/home/builder USER=builder LOGNAME=builder GITHUB_TOKEN=CANARY_ghp_00000000\"... AWS_SECRET_ACCESS_KEY=CANARY_FAK\"... makepkg --noconfirm --nobuild --nodeps --skippgpcheck",
        "parent": null,
        "timestamp": "2026-10-08T20:14:15.026363695+00:00",
        "phase": "build"
      },
      {
        "command": "env -C /home/builder/build HOME=/home/builder USER=builder LOGNAME=builder GITHUB_TOKEN=CANARY_ghp_00000000\"... AWS_SECRET_ACCESS_KEY=CANARY_FAK\"... makepkg --noconfirm --nobuild --nodeps --skippgpcheck",
        "parent": null,
        "timestamp": "2026-10-08T20:14:15.026363695+00:00",
        "phase": "build"
      },
      {
        "command": "makepkg --noconfirm --nobuild --nodeps --skippgpcheck",
        "parent": null,
        "timestamp": "2026-10-08T20:14:15.026363695+00:00",
        "phase": "build"
      },
      {
        "command": "date +%s",
        "parent": null,
        "timestamp": "2026-10-08T20:14:15.026363695+00:00",
        "phase": "build"
      },
      {
        "command": "gettext %s signal caught. Exiting...",
        "parent": null,
        "timestamp": "2026-10-08T20:14:15.026363695+00:00",
        "phase": "build"
      },
      {
        "command": "mkdir -p /home/builder/build",
        "parent": null,
        "timestamp": "2026-10-08T20:14:15.026363695+00:00",
        "phase": "build"
      },
      {
        "command": "sort -u",
        "parent": null,
        "timestamp": "2026-10-08T20:14:15.026363695+00:00",
        "phase": "build"
      },
      {
        "command": "wc -l",
        "parent": null,
        "timestamp": "2026-10-08T20:14:15.026363695+00:00",
        "phase": "build"
      },
      {
        "command": "grep -E ^[[:space:",
        "parent": null,
        "timestamp": "2026-10-08T20:14:15.026363695+00:00",
        "phase": "build"
      },
      {
        "command": "gettext Making package: %s",
        "parent": null,
        "timestamp": "2026-10-08T20:14:15.026363695+00:00",
        "phase": "build"
      },
      {
        "command": "date +%c",
        "parent": null,
        "timestamp": "2026-10-08T20:14:15.026363695+00:00",
        "phase": "build"
      },
      {
        "command": "gettext Skipping dependency checks.",
        "parent": null,
        "timestamp": "2026-10-08T20:14:15.026363695+00:00",
        "phase": "build"
      },
      {
        "command": "gettext WARNING:",
        "parent": null,
        "timestamp": "2026-10-08T20:14:15.026363695+00:00",
        "phase": "build"
      },
      {
        "command": "mkdir -p /home/builder/build/src",
        "parent": null,
        "timestamp": "2026-10-08T20:14:15.026363695+00:00",
        "phase": "build"
      },
      {
        "command": "chmod a-s /home/builder/build/src",
        "parent": null,
        "timestamp": "2026-10-08T20:14:15.026363695+00:00",
        "phase": "build"
      },
      {
        "command": "gettext Retrieving sources...",
        "parent": null,
        "timestamp": "2026-10-08T20:14:15.026363695+00:00",
        "phase": "build"
      },
      {
        "command": "gettext Downloading %s...",
        "parent": null,
        "timestamp": "2026-10-08T20:14:15.026363695+00:00",
        "phase": "build"
      },
      {
        "command": "/usr/bin/curl -qgb \\\"\\ -fLC - --retry 3 --retry-delay 3 -o alphadb-bin-1.0.0_beta.51.tar.gz\"... https://github.com/w-kuipers/alp\"...",
        "parent": null,
        "timestamp": "2026-10-08T20:14:15.026363695+00:00",
        "phase": "build"
      },
      {
        "command": "mv -f /home/builder/build/alphadb-bin-\"... /home/builder/build/alphadb-bin-\"...",
        "parent": null,
        "timestamp": "2026-10-08T20:14:15.026363695+00:00",
        "phase": "build"
      },
      {
        "command": "gettext Skipping verification of source \"...",
        "parent": null,
        "timestamp": "2026-10-08T20:14:15.026363695+00:00",
        "phase": "build"
      },
      {
        "command": "gettext Validating %s files with %s...",
        "parent": null,
        "timestamp": "2026-10-08T20:14:15.026363695+00:00",
        "phase": "build"
      },
      {
        "command": "sha256sum /home/builder/build/alphadb-bin-\"...",
        "parent": null,
        "timestamp": "2026-10-08T20:14:15.026363695+00:00",
        "phase": "build"
      },
      {
        "command": "gettext Passed",
        "parent": null,
        "timestamp": "2026-10-08T20:14:15.026363695+00:00",
        "phase": "build"
      },
      {
        "command": "gettext Extracting sources...",
        "parent": null,
        "timestamp": "2026-10-08T20:14:15.026363695+00:00",
        "phase": "build"
      },
      {
        "command": "rm -f /home/builder/build/src/alphadb-\"...",
        "parent": null,
        "timestamp": "2026-10-08T20:14:15.026363695+00:00",
        "phase": "build"
      },
      {
        "command": "ln -s /home/builder/build/alphadb-bin-\"... /home/builder/build/src/",
        "parent": null,
        "timestamp": "2026-10-08T20:14:15.026363695+00:00",
        "phase": "build"
      },
      {
        "command": "file -S -bizL -- alphadb-bin-1.0.0_beta.51.tar.gz",
        "parent": null,
        "timestamp": "2026-10-08T20:14:15.026363695+00:00",
        "phase": "build"
      },
      {
        "command": "gettext Extracting %s with %s",
        "parent": null,
        "timestamp": "2026-10-08T20:14:15.026363695+00:00",
        "phase": "build"
      },
      {
        "command": "bsdtar -xf alphadb-bin-1.0.0_beta.51.tar.gz",
        "parent": null,
        "timestamp": "2026-10-08T20:14:15.026363695+00:00",
        "phase": "build"
      },
      {
        "command": "gettext Sources are ready.",
        "parent": null,
        "timestamp": "2026-10-08T20:14:15.026363695+00:00",
        "phase": "build"
      },
      {
        "command": "bash -c \\n    exec 2>&1\\n    for fd in /pr\"... aur-sentry-traced env GITHUB_TOKEN=CANARY_ghp_00000000\"... AWS_SECRET_ACCESS_KEY=CANARY_FAK\"... pacman -U --noconfirm /pkg/alphadb-bin-1.0.0_beta.51-1\"...",
        "parent": null,
        "timestamp": "2026-10-08T20:14:15.034457356+00:00",
        "phase": "install"
      },
      {
        "command": "env GITHUB_TOKEN=CANARY_ghp_00000000\"... AWS_SECRET_ACCESS_KEY=CANARY_FAK\"... pacman -U --noconfirm /pkg/alphadb-bin-1.0.0_beta.51-1\"...",
        "parent": null,
        "timestamp": "2026-10-08T20:14:15.034457356+00:00",
        "phase": "install"
      },
      {
        "command": "pacman -U --noconfirm /pkg/alphadb-bin-1.0.0_beta.51-1\"...",
        "parent": null,
        "timestamp": "2026-10-08T20:14:15.034457356+00:00",
        "phase": "install"
      },
      {
        "command": "ldconfig",
        "parent": null,
        "timestamp": "2026-10-08T20:14:15.034457356+00:00",
        "phase": "install"
      },
      {
        "command": "/usr/share/libalpm/scripts/syste\"... update",
        "parent": null,
        "timestamp": "2026-10-08T20:14:15.034457356+00:00",
        "phase": "install"
      },
      {
        "command": "touch -c /usr",
        "parent": null,
        "timestamp": "2026-10-08T20:14:15.034457356+00:00",
        "phase": "install"
      },
      {
        "command": "bash -c \\n    exec 2>&1\\n    for fd in /pr\"... aur-sentry-traced pacman -R --noconfirm alphadb-bin",
        "parent": null,
        "timestamp": "2026-10-08T20:14:15.034457356+00:00",
        "phase": "install"
      },
      {
        "command": "pacman -R --noconfirm alphadb-bin",
        "parent": null,
        "timestamp": "2026-10-08T20:14:15.034457356+00:00",
        "phase": "install"
      }
    ],
    "network": [
      {
        "destination": "10.0.2.3",
        "port": 53,
        "protocol": "undeclared",
        "timestamp": "2026-10-08T20:14:15.026363695+00:00",
        "phase": "build"
      },
      {
        "destination": "140.82.113.3",
        "port": 443,
        "protocol": "undeclared",
        "timestamp": "2026-10-08T20:14:15.026363695+00:00",
        "phase": "build"
      },
      {
        "destination": "185.199.108.133",
        "port": 443,
        "protocol": "undeclared",
        "timestamp": "2026-10-08T20:14:15.026363695+00:00",
        "phase": "build"
      }
    ],
    "filesystem": []
  },
  "package_analysis": {
    "available": true,
    "file_count": 1,
    "elf_object_count": 1,
    "elf_objects": [
      {
        "path": "usr/bin/alphadb",
        "arch": "Advanced Micro Devices X86-64",
        "stripped": true,
        "pie": true
      }
    ],
    "setuid_files": 0,
    "world_writable_files": 0
  },
  "reproducibility": "DIVERGED",
  "external_intelligence": [],
  "verdict": "SUSPICIOUS",
  "evidence_hash": "729ade14a0eee7c8de518775e4e4339a6b385e6d189c5a0c63d7c4e3c29268d0",
  "signature": null
}
