{
  "schema_version": "1.0",
  "package": {
    "name": "aether",
    "version": "4.31.0-1",
    "arch": "x86_64"
  },
  "source": {
    "aur_commit": "dc257c688d8be38e5ff6b4e4e1fae9b674ebfdc9",
    "pkgbuild_sha256": "020d8041ea24dbb058fbde37e9f2af9d86f5630afe2a19b5a1da056f619ed29e",
    "install_sha256": null
  },
  "analyzed_at": "2026-09-29T08:59:25.131537190+00:00",
  "scanner_version": "aur-sentry/0.1.0",
  "static_findings": [
    {
      "behavior": "NETWORK_ACCESS",
      "file": "dynamic-sandbox",
      "line": 0,
      "severity": "HIGH",
      "description": "connected to network destination(s) not declared in PKGBUILD source=() during build"
    },
    {
      "behavior": "NETWORK_ACCESS",
      "file": "dynamic-sandbox",
      "line": 0,
      "severity": "HIGH",
      "description": "connected to network destination(s) not declared in PKGBUILD source=() during install"
    }
  ],
  "dynamic_evidence": {
    "collected": true,
    "processes": [],
    "network": [
      {
        "destination": "172.17.0.1",
        "port": 53,
        "protocol": "undeclared",
        "timestamp": "2026-09-29T08:59:25.074820965+00:00",
        "phase": "build"
      },
      {
        "destination": "140.82.113.3",
        "port": 443,
        "protocol": "undeclared",
        "timestamp": "2026-09-29T08:59:25.074820965+00:00",
        "phase": "build"
      },
      {
        "destination": "140.82.113.9",
        "port": 443,
        "protocol": "undeclared",
        "timestamp": "2026-09-29T08:59:25.074820965+00:00",
        "phase": "build"
      },
      {
        "destination": "185.199.111.133",
        "port": 443,
        "protocol": "undeclared",
        "timestamp": "2026-09-29T08:59:25.074820965+00:00",
        "phase": "build"
      },
      {
        "destination": "172.17.0.1",
        "port": 53,
        "protocol": "undeclared",
        "timestamp": "2026-09-29T08:59:25.096083863+00:00",
        "phase": "install"
      },
      {
        "destination": "151.101.3.52",
        "port": 443,
        "protocol": "undeclared",
        "timestamp": "2026-09-29T08:59:25.096083863+00:00",
        "phase": "install"
      }
    ],
    "filesystem": []
  },
  "package_analysis": {
    "available": true,
    "file_count": 13,
    "elf_object_count": 1,
    "elf_objects": [
      {
        "path": "usr/bin/aether",
        "arch": "Advanced Micro Devices X86-64",
        "stripped": true,
        "pie": false
      }
    ],
    "setuid_files": 0,
    "world_writable_files": 0
  },
  "reproducibility": "DIVERGED",
  "external_intelligence": [],
  "verdict": "SUSPICIOUS",
  "evidence_hash": "f0cdf194ce51d2de511d2bb103d8201cbb7b7e365979f408bbf8beb024f46a4b",
  "signature": null
}
